{
  "id": "cv.continuous/sowing/no-skip-with-twelve-seeds",
  "description": "Twelve seeds from pit 1 go once round the board and the last one lands in the (empty) starting pit: nothing is skipped, and the move ends there.",
  "variants": [
    {
      "id": "cv.continuous",
      "version": 1
    }
  ],
  "source": "docs/game/variants/cape-verde/continuous.md#evidence-by-parameter",
  "tags": [
    "sowing",
    "lap",
    "to-confirm"
  ],
  "setup": {
    "pits": [
      12,
      2,
      3,
      3,
      3,
      3,
      3,
      3,
      3,
      3,
      3,
      3
    ],
    "stores": [
      2,
      2
    ],
    "to_move": "south",
    "moves_since_capture": 0
  },
  "steps": [
    {
      "expect_legal_moves": [
        0,
        1,
        2,
        3,
        4,
        5
      ],
      "move": 0,
      "expect": {
        "pits": [
          1,
          3,
          4,
          4,
          4,
          4,
          4,
          4,
          4,
          4,
          4,
          4
        ],
        "stores": [
          2,
          2
        ],
        "to_move": "north",
        "status": "playing",
        "events": [
          {
            "type": "sow",
            "pit": 1
          },
          {
            "type": "sow",
            "pit": 2
          },
          {
            "type": "sow",
            "pit": 3
          },
          {
            "type": "sow",
            "pit": 4
          },
          {
            "type": "sow",
            "pit": 5
          },
          {
            "type": "sow",
            "pit": 6
          },
          {
            "type": "sow",
            "pit": 7
          },
          {
            "type": "sow",
            "pit": 8
          },
          {
            "type": "sow",
            "pit": 9
          },
          {
            "type": "sow",
            "pit": 10
          },
          {
            "type": "sow",
            "pit": 11
          },
          {
            "type": "sow",
            "pit": 0
          }
        ]
      }
    }
  ]
}
