{
  "id": "cv.standard/capture/chain-stops-at-four",
  "description": "Pit 8 is captured (2) but the chain stops at pit 7 (4 seeds), so pit 6 (2) is not captured.",
  "variants": [
    { "id": "cv.standard", "version": 1 }
  ],
  "source": "docs/game/rules.md#capturing",
  "tags": [
    "capture",
    "chain"
  ],
  "setup": {
    "pits": [4, 4, 4, 4, 4, 0, 1, 3, 1, 4, 4, 4],
    "stores": [6, 5],
    "to_move": "south"
  },
  "steps": [
    {
      "move": 4,
      "expect": {
        "pits": [4, 4, 4, 4, 0, 1, 2, 4, 0, 4, 4, 4],
        "stores": [8, 5],
        "to_move": "north",
        "status": "playing",
        "events": [
          { "type": "sow", "pit": 5 },
          { "type": "sow", "pit": 6 },
          { "type": "sow", "pit": 7 },
          { "type": "sow", "pit": 8 },
          { "type": "capture", "pit": 8, "seeds": 2 }
        ]
      }
    }
  ]
}
