{
  "id": "cv.standard/grand-slam/extra-turn-must-feed",
  "description": "Grand slam captures all North seeds (5); South (23 < 25) plays again and must feed with pit 5.",
  "variants": [
    { "id": "cv.standard", "version": 1 }
  ],
  "source": "docs/game/rules.md#5-grand-slam-with-extra-turn",
  "tags": [
    "grand-slam",
    "feeding"
  ],
  "setup": {
    "pits": [0, 0, 0, 1, 3, 0, 1, 2, 0, 0, 0, 0],
    "stores": [18, 23],
    "to_move": "south"
  },
  "steps": [
    {
      "expect_legal_moves": [4],
      "move": 4,
      "expect": {
        "pits": [0, 0, 0, 1, 0, 1, 0, 0, 0, 0, 0, 0],
        "stores": [23, 23],
        "to_move": "south",
        "status": "playing",
        "events": [
          { "type": "sow", "pit": 5 },
          { "type": "sow", "pit": 6 },
          { "type": "sow", "pit": 7 },
          { "type": "capture", "pit": 7, "seeds": 3 },
          { "type": "capture", "pit": 6, "seeds": 2 },
          { "type": "grand_slam" },
          { "type": "extra_turn" }
        ]
      }
    },
    {
      "expect_legal_moves": [5],
      "move": 5,
      "expect": {
        "pits": [0, 0, 0, 1, 0, 0, 1, 0, 0, 0, 0, 0],
        "stores": [23, 23],
        "to_move": "north",
        "status": "playing",
        "events": [
          { "type": "sow", "pit": 6 }
        ]
      }
    }
  ]
}
